{
  "exercise_id": "ex-cp-n2-0001",
  "version": 1,
  "locale": "fr-FR",
  "age_target": 6,
  "skill_id": "CP.MA.N2.4",
  "difficulty_level": 2,
  "exercise_type": "QCM",
  "question_text": "Complète: 7 + __ = 10",
  "options": [
    { "id": "opt_a", "text": "2" },
    { "id": "opt_b", "text": "3" }
  ],
  "correct_option_id": "opt_b",
  "correct_answer": null,
  "step_by_step_solution": [
    { "step": 1, "explanation_text": "On cherche le complément de 7 pour faire 10." },
    { "step": 2, "explanation_text": "7 + 3 = 10, donc la réponse est 3." }
  ],
  "key_concept_takeaway": "Compléter à 10 se fait en trouvant la différence avec 10.",
  "xp_reward": 10,
  "hint_penalty": 2,
  "tags": ["addition", "complements_10"],
  "generator_meta": { "model": "Cursor-Worker" },
  "judge_scores": {
    "clarity": 9.5,
    "factuality": 10,
    "age_fit": 9.5,
    "overall": 9.5,
    "justification": "Clair, adapté CP."
  },
  "content_hash": null,
  "license": "internal",
  "visibility": "internal"
}
